Page,Result,Title,Link,Abstract
10,8,Privacy-preserving data publishing,https://www.nowpublishers.com/article/Details/DBS-008,"… Research on protecting the privacy of individuals and the … computer science, statistics,
economics, and social science. In this paper, we survey research work in privacy-preserving data …"
10,9,Efficient privacy preserving video surveillance,https://ieeexplore.ieee.org/abstract/document/5459370/,"… In this paper, we propose an efficient framework to carry out privacy preserving surveillance.
We … to Secure Multiparty Computation, making privacy preserving surveillance, practical. …"
10,10,Efficient and privacy-preserving medical data sharing in Internet of Things with limited computing power,https://ieeexplore.ieee.org/abstract/document/8365879/,"With the application of Internet of Things (IoT) technologies in smart city, intelligent medical
terminals play a more and more significant role in our daily life. These terminals can monitor …"
